{
  "$schema": "https://json-schema.org/draft/2020-12/schema",
  "title": "Dreamcoder OS design tokens",
  "type": "object",
  "required": ["name", "version", "modes", "render_profiles", "guardrails"],
  "properties": {
    "$schema": { "type": "string" },
    "name": { "const": "Dreamcoder OS" },
    "version": { "type": "integer", "minimum": 1 },
    "description": { "type": "string" },
    "render_profiles": {
          "type": "object",
          "required": ["night"],
          "properties": {
            "night": {
              "type": "object",
              "required": [
                "brightness_factor",
                "saturation_factor",
                "maximum_corrective_delta",
                "corrective_step"
              ],
              "properties": {
                "brightness_factor": {
                  "type": "number",
                  "exclusiveMinimum": 0,
                  "maximum": 1
                },
                "saturation_factor": {
                  "type": "number",
                  "exclusiveMinimum": 0,
                  "maximum": 1
                },
                "maximum_corrective_delta": {
                  "type": "number",
                  "minimum": 0,
                  "maximum": 0.2
                },
                "corrective_step": {
                  "type": "number",
                  "exclusiveMinimum": 0,
                  "maximum": 0.2
                }
              }
            }
          }
        },
    "modes": {
      "type": "object",
      "required": ["dark", "light", "dusk"],
      "properties": {
        "dark": {
          "allOf": [
            { "$ref": "#/$defs/palette" },
            { "required": ["aliases", "effects", "typography", "surface_policy"] }
          ]
        },
        "light": {
          "allOf": [
            { "$ref": "#/$defs/palette" },
            { "$ref": "#/$defs/base_palette" }
          ]
        },
        "dusk": {
          "allOf": [
            { "$ref": "#/$defs/palette" },
            { "$ref": "#/$defs/base_palette" }
          ]
        }
      },
      "additionalProperties": false
    },
    "guardrails": {
      "type": "object",
      "required": [
        "canonical_opencode_theme",
        "minimum_text_contrast",
        "preferred_main_text_contrast",
        "minimum_terminal_ansi_contrast",
        "minimum_terminal_cursor_contrast",
        "minimum_terminal_selection_contrast",
        "minimum_apca_body",
        "minimum_apca_body_dark",
        "minimum_apca_heading_light",
        "minimum_apca_heading_dark",
        "minimum_apca_quiet",
        "minimum_apca_ui",
        "minimum_apca_ui_dark",
        "minimum_apca_on_accent"
      ],
      "properties": {
        "canonical_opencode_theme": { "const": "dreamcoder" },
        "minimum_text_contrast": { "type": "number", "minimum": 4.5 },
        "preferred_main_text_contrast": { "type": "number", "minimum": 7 },
        "minimum_apca_body": { "type": "number", "minimum": 60 },
        "minimum_apca_body_dark": { "type": "number", "minimum": 45 },
        "minimum_apca_heading_light": { "type": "number", "minimum": 45 },
        "minimum_apca_heading_dark": { "type": "number", "minimum": 40 },
        "minimum_apca_quiet": { "type": "number", "minimum": 44 },
        "minimum_apca_ui": { "type": "number", "minimum": 28 },
        "minimum_apca_ui_dark": { "type": "number", "minimum": 28 },
        "minimum_apca_on_accent": { "type": "number", "minimum": 60 },
        "light_hours_default": { "type": "string" },
        "dusk_hours_default": { "type": "string" },
        "minimum_terminal_ansi_contrast": { "type": "number", "minimum": 4.5 },
        "minimum_terminal_cursor_contrast": {
          "type": "number",
          "minimum": 4.5
        },
        "minimum_terminal_selection_contrast": {
          "type": "number",
          "minimum": 7
        }
      },
      "additionalProperties": false
    }
  },
  "$defs": {
    "hex": { "type": "string", "pattern": "^#[0-9a-fA-F]{6}$" },
    "rgba_color": {
      "type": "string",
      "pattern": "^rgba\\(\\s*\\d{1,3}\\s*,\\s*\\d{1,3}\\s*,\\s*\\d{1,3}\\s*,\\s*(0|1|0?\\.\\d+)\\s*\\)$"
    },
    "color_value": {
      "oneOf": [{ "$ref": "#/$defs/hex" }, { "$ref": "#/$defs/rgba_color" }]
    },
    "palette": {
      "type": "object",
      "required": [
        "name",
        "details",
        "bg",
        "bg_soft",
        "surface0",
        "surface1",
        "surface2",
        "surface3",
        "text",
        "text_heading",
        "muted",
        "subtle",
        "comment",
        "border",
        "border_ui",
        "border_hi",
        "focus",
        "accent",
        "accent_2",
        "diagnostic",
        "sage",
        "success",
        "info",
        "error",
        "warning",
        "lavender",
        "mauve",
        "on_surface",
        "on_accent",
        "on_error",
        "on_focus",
        "link",
        "link_hover",
        "selection",
        "selection_bg",
        "selection_fg",
        "disabled",
        "hover",
        "pressed",
        "overlay",
        "scrim",
        "panel_rgba",
        "module_rgba",
        "active_rgba",
        "inactive_border",
        "prompt_bg",
        "prompt_surface0",
        "prompt_surface1",
        "prompt_surface2",
        "prompt_text",
        "prompt_muted",
        "prompt_accent",
        "prompt_accent_2"
      ],
      "properties": {
        "name": { "type": "string" },
        "details": { "enum": ["darker", "lighter"] },
        "bg": { "$ref": "#/$defs/color_value" },
        "bg_soft": { "$ref": "#/$defs/color_value" },
        "surface0": { "$ref": "#/$defs/color_value" },
        "surface1": { "$ref": "#/$defs/color_value" },
        "surface2": { "$ref": "#/$defs/color_value" },
        "surface3": { "$ref": "#/$defs/color_value" },
        "text": { "$ref": "#/$defs/color_value" },
        "text_heading": { "$ref": "#/$defs/color_value" },
        "muted": { "$ref": "#/$defs/color_value" },
        "subtle": { "$ref": "#/$defs/color_value" },
        "comment": { "$ref": "#/$defs/color_value" },
        "border": { "$ref": "#/$defs/color_value" },
        "border_ui": { "$ref": "#/$defs/color_value" },
        "border_hi": { "$ref": "#/$defs/color_value" },
        "focus": { "$ref": "#/$defs/color_value" },
        "accent": { "$ref": "#/$defs/color_value" },
        "accent_2": { "$ref": "#/$defs/color_value" },
        "diagnostic": { "$ref": "#/$defs/color_value" },
        "sage": { "$ref": "#/$defs/color_value" },
        "success": { "$ref": "#/$defs/color_value" },
        "info": { "$ref": "#/$defs/color_value" },
        "error": { "$ref": "#/$defs/color_value" },
        "warning": { "$ref": "#/$defs/color_value" },
        "lavender": { "$ref": "#/$defs/color_value" },
        "mauve": { "$ref": "#/$defs/color_value" },
        "on_surface": { "$ref": "#/$defs/color_value" },
        "on_accent": { "$ref": "#/$defs/color_value" },
        "on_error": { "$ref": "#/$defs/color_value" },
        "on_focus": { "$ref": "#/$defs/color_value" },
        "link": { "$ref": "#/$defs/color_value" },
        "link_hover": { "$ref": "#/$defs/color_value" },
        "selection": { "$ref": "#/$defs/color_value" },
        "selection_bg": { "$ref": "#/$defs/color_value" },
        "selection_fg": { "$ref": "#/$defs/color_value" },
        "disabled": { "$ref": "#/$defs/color_value" },
        "hover": { "$ref": "#/$defs/color_value" },
        "pressed": { "$ref": "#/$defs/color_value" },
        "overlay": { "$ref": "#/$defs/color_value" },
        "scrim": { "$ref": "#/$defs/color_value" },
        "panel_rgba": { "$ref": "#/$defs/color_value" },
        "module_rgba": { "$ref": "#/$defs/color_value" },
        "active_rgba": { "$ref": "#/$defs/color_value" },
        "inactive_border": { "$ref": "#/$defs/color_value" },
        "prompt_bg": { "$ref": "#/$defs/color_value" },
        "prompt_surface0": { "$ref": "#/$defs/color_value" },
        "prompt_surface1": { "$ref": "#/$defs/color_value" },
        "prompt_surface2": { "$ref": "#/$defs/color_value" },
        "prompt_text": { "$ref": "#/$defs/color_value" },
        "prompt_muted": { "$ref": "#/$defs/color_value" },
            "prompt_accent": { "$ref": "#/$defs/color_value" },
            "prompt_accent_2": { "$ref": "#/$defs/color_value" },
            "aliases": { "$ref": "#/$defs/dark_aliases" },
            "effects": { "$ref": "#/$defs/dark_effects" },
            "typography": { "$ref": "#/$defs/dark_typography" },
            "surface_policy": { "$ref": "#/$defs/dark_surface_policy" }
          },
          "additionalProperties": { "$ref": "#/$defs/color_value" }
        },
        "base_palette": {
          "not": {
            "anyOf": [
              { "required": ["aliases"] },
              { "required": ["effects"] },
              { "required": ["typography"] },
              { "required": ["surface_policy"] }
            ]
          }
        },
        "dark_aliases": {
          "type": "object",
          "required": ["border_subtle", "border_medium", "text_muted", "brand", "error_requested"],
          "additionalProperties": { "$ref": "#/$defs/hex" }
        },
        "dark_effects": {
          "type": "object",
          "required": ["glow_brand", "glow_focus", "glow_error"],
          "additionalProperties": { "type": "string", "minLength": 1 }
        },
        "dark_typography": {
          "type": "object",
          "required": ["body_weight", "emphasis_weight", "heading_weight", "letter_spacing", "uppercase_letter_spacing"],
          "properties": {
            "body_weight": { "type": "integer", "minimum": 100, "maximum": 900 },
            "emphasis_weight": { "type": "integer", "minimum": 100, "maximum": 900 },
            "heading_weight": { "type": "integer", "minimum": 100, "maximum": 900 },
            "letter_spacing": { "type": "string" },
            "uppercase_letter_spacing": { "type": "string" }
          },
          "additionalProperties": false
        },
        "dark_surface_policy": {
          "type": "object",
          "required": ["selector", "scroll_surface", "pure_black_policy"],
          "properties": {
            "selector": { "const": ":root[data-theme=\"dark\"]" },
            "scroll_surface": { "const": "surface0" },
            "pure_black_policy": {
              "type": "object",
              "required": ["canvas", "functional_surfaces", "scrollable_surfaces"],
              "properties": {
                "canvas": { "const": true },
                "functional_surfaces": { "const": false },
                "scrollable_surfaces": { "const": false }
              },
              "additionalProperties": false
            }
          },
          "additionalProperties": false
        }
      },
      "additionalProperties": false
    }
