{
  "$schema": "./tokens.schema.json",
  "name": "Dreamcoder OS",
  "version": 1,
  "description": "Canonical Dreamcoder visual tokens. Dreamcoder Dark uses an OLED-aware surface policy, alongside premium Cocoa/L\u00facuma Light and the Dusk transition.",
  "modes": {
    "dark": {
      "name": "Dreamcoder Dark",
      "bg": "#000000",
      "bg_soft": "#0B0B0B",
      "surface0": "#0B0B0B",
      "surface1": "#0D0D0F",
      "surface2": "#1F1F1F",
      "surface3": "#2E2E2E",
      "text": "#E6E6E6",
      "text_heading": "#F5F5F5",
      "muted": "#C7C7C7",
      "subtle": "#A7A7A7",
      "comment": "#D0D0D0",
      "border": "#6B6B6B",
      "border_ui": "#767676",
      "border_hi": "#A7A7A7",
      "focus": "#3B82F6",
      "accent": "#A5B4FC",
      "accent_2": "#D4B5FD",
      "diagnostic": "#7DD3FC",
      "selection": "#3A3A3A",
      "panel_rgba": "rgba(13, 13, 15, 0.92)",
      "module_rgba": "rgba(230, 230, 230, 0.08)",
      "active_rgba": "rgba(99, 102, 241, 0.28)",
      "inactive_border": "rgba(46, 46, 46, 0.84)",
      "details": "darker",
      "prompt_bg": "#000000",
      "prompt_surface0": "#0B0B0B",
      "prompt_surface1": "#0D0D0F",
      "prompt_surface2": "#1F1F1F",
      "prompt_text": "#E6E6E6",
      "prompt_muted": "#C7C7C7",
      "prompt_accent": "#A5B4FC",
      "prompt_accent_2": "#D4B5FD",
      "sage": "#34D399",
      "lavender": "#D4B5FD",
      "mauve": "#D8B4FE",
      "error": "#FB8585",
      "warning": "#FBBF24",
      "success": "#34D399",
      "info": "#7DD3FC",
      "selection_bg": "#3A3A3A",
      "selection_fg": "#E6E6E6",
      "on_surface": "#E6E6E6",
      "on_accent": "#000000",
      "on_error": "#000000",
      "on_focus": "#000000",
      "link": "#A5B4FC",
      "link_hover": "#D4B5FD",
      "disabled": "#A7A7A7",
      "hover": "#3A3A3A",
      "pressed": "#1F1F1F",
      "overlay": "rgba(0, 0, 0, 0.64)",
      "scrim": "rgba(0, 0, 0, 0.78)",
      "aliases": {
        "border_subtle": "#1F1F1F",
        "border_medium": "#3A3A3A",
        "text_muted": "#A7A7A7",
        "brand": "#6366F1",
        "error_requested": "#F87171"
      },
      "effects": {
        "glow_brand": "0 0 24px rgba(99, 102, 241, 0.28)",
        "glow_focus": "0 0 0 3px rgba(59, 130, 246, 0.30)",
        "glow_error": "0 0 20px rgba(248, 113, 113, 0.22)"
      },
      "typography": {
        "body_weight": 400,
        "emphasis_weight": 500,
        "heading_weight": 600,
        "letter_spacing": "0em",
        "uppercase_letter_spacing": "0.04em"
      },
      "surface_policy": {
        "selector": ":root[data-theme=\"dark\"]",
        "scroll_surface": "surface0",
        "pure_black_policy": {
          "canvas": true,
          "functional_surfaces": false,
          "scrollable_surfaces": false
        }
      }
    },
    "light": {
      "name": "Dreamcoder Light",
      "bg": "#f3eadc",
      "bg_soft": "#e6d7c4",
      "surface0": "#fff7ea",
      "surface1": "#decbb1",
      "surface2": "#c8ad89",
      "text": "#17120d",
      "muted": "#352e22",
      "subtle": "#554638",
      "comment": "#725e4c",
      "border": "#8a7358",
      "border_ui": "#66513b",
      "border_hi": "#3e2f20",
      "focus": "#0f6570",
      "accent": "#824f16",
      "accent_2": "#a7471c",
      "diagnostic": "#0d4a68",
      "sage": "#315b31",
      "lavender": "#57478b",
      "mauve": "#7d3e64",
      "error": "#842f24",
      "warning": "#654300",
      "selection": "#decbb1",
      "panel_rgba": "rgba(243, 234, 220, 0.96)",
      "module_rgba": "rgba(222, 203, 177, 0.80)",
      "active_rgba": "rgba(130, 79, 22, 0.34)",
      "inactive_border": "rgba(138, 115, 88, 0.93)",
      "details": "lighter",
      "prompt_bg": "#f3eadc",
      "prompt_surface0": "#fff0d8",
      "prompt_surface1": "#d6ac72",
      "prompt_surface2": "#b87c40",
      "prompt_text": "#20150c",
      "prompt_muted": "#53402e",
      "prompt_accent": "#8a5520",
      "prompt_accent_2": "#a7471c",
      "success": "#315b31",
      "info": "#0d4a68",
      "text_heading": "#100c07",
      "surface3": "#b89d7a",
      "selection_bg": "#decbb1",
      "selection_fg": "#17120d",
      "on_surface": "#17120d",
      "on_accent": "#fff7ea",
      "on_error": "#fff7ea",
      "on_focus": "#fff7ea",
      "link": "#824f16",
      "link_hover": "#a7471c",
      "disabled": "#71695d",
      "hover": "#decbb1",
      "pressed": "#c8ad89",
      "overlay": "rgba(243, 234, 220, 0.40)",
      "scrim": "rgba(26, 18, 12, 0.42)"
    },
    "dusk": {
      "name": "Dreamcoder Dusk",
      "bg": "#ebe4d6",
      "bg_soft": "#dfd5c4",
      "surface0": "#f1eadf",
      "surface1": "#d8cbb8",
      "surface2": "#c6b6a0",
      "text": "#1a1713",
      "muted": "#4c443a",
      "subtle": "#5a4f43",
      "comment": "#615548",
      "border": "#a7947a",
      "border_ui": "#665845",
      "border_hi": "#4a3f32",
      "focus": "#216a73",
      "accent": "#8a5520",
      "accent_2": "#96411e",
      "diagnostic": "#104b67",
      "sage": "#344f30",
      "lavender": "#5b4e86",
      "mauve": "#784762",
      "error": "#773126",
      "warning": "#604000",
      "selection": "#d8cbb8",
      "panel_rgba": "rgba(235, 228, 214, 0.88)",
      "module_rgba": "rgba(26, 23, 19, 0.08)",
      "active_rgba": "rgba(138, 85, 32, 0.22)",
      "inactive_border": "rgba(167, 148, 122, 0.87)",
      "details": "lighter",
      "prompt_bg": "#ebe4d6",
      "prompt_surface0": "#f2e6d4",
      "prompt_surface1": "#d3bc98",
      "prompt_surface2": "#b88958",
      "prompt_text": "#261c14",
      "prompt_muted": "#574939",
      "prompt_accent": "#965f25",
      "prompt_accent_2": "#96411e",
      "success": "#344f30",
      "info": "#104b67",
      "text_heading": "#13100c",
      "surface3": "#b6a691",
      "selection_bg": "#d8cbb8",
      "selection_fg": "#1a1713",
      "on_surface": "#1a1713",
      "on_accent": "#f1eadf",
      "on_error": "#f1eadf",
      "on_focus": "#f1eadf",
      "link": "#8a5520",
      "link_hover": "#96411e",
      "disabled": "#6c655c",
      "hover": "#d8cbb8",
      "pressed": "#c6b6a0",
      "overlay": "rgba(235, 228, 214, 0.40)",
      "scrim": "rgba(26, 18, 12, 0.42)"
    }
  },
  "render_profiles": {
    "night": {
      "brightness_factor": 0.86,
      "saturation_factor": 0.72,
      "maximum_corrective_delta": 0.12,
      "corrective_step": 0.02
    }
  },
  "guardrails": {
    "minimum_text_contrast": 4.5,
    "preferred_main_text_contrast": 7.0,
    "minimum_apca_body": 75,
    "minimum_apca_body_dark": 50,
    "minimum_apca_quiet": 44,
    "minimum_apca_ui": 60,
    "minimum_apca_ui_dark": 28,
    "light_hours_default": "07:00-16:00",
    "dusk_hours_default": "16:00-18:00",
    "canonical_opencode_theme": "dreamcoder",
    "minimum_terminal_ansi_contrast": 4.5,
    "minimum_terminal_cursor_contrast": 4.5,
    "minimum_terminal_selection_contrast": 7.0,
    "minimum_apca_on_accent": 60,
    "minimum_apca_heading_light": 60,
    "minimum_apca_heading_dark": 45
  }
}
